{
  "schemaVersion": "0.1.0",
  "id": "gm-pack-upper-limb-bones-v0",
  "status": "candidate_demo_not_promoted",
  "nodeRef": "gm-ma-identify-upper-limb-long-flat-bones",
  "language": "es",
  "title": "Orientar los cinco huesos principales del miembro superior",
  "objective": "Identifica y orienta clavícula, escápula, húmero, radio y ulna mediante sus principales accidentes anatómicos.",
  "description": "Unidad profunda de un solo nodo: construye un mapa espacial, discrimina accidentes anatómicos y transfiere la orientación a descripciones e imágenes nuevas.",
  "estimatedMinutes": 51,
  "design": {
    "scoredActivities": 29,
    "teachingActivities": 4,
    "formats": ["single_choice", "multiple_select", "sequence", "short_answer"],
    "evidenceLevels": ["A1", "A2", "A3", "A4"],
    "masteryBoundary": "Completion of this pack does not establish competence or transfer.",
    "variantPolicy": "Prompt direction, distractor order and representation may vary without changing the objective or scoring key."
  },
  "lessons": [
    {
      "id": "gm-pack-bones-l01",
      "title": "Mapa inicial",
      "kind": "diagnostic",
      "durationMinutes": 6,
      "focus": ["A1"],
      "description": "Detecta qué relaciones ya puedes recuperar antes de recibir enseñanza.",
      "activities": [
        {
          "id": "bones-l01-a01",
          "type": "single_choice",
          "title": "¿Qué hueso conecta el miembro superior con el esqueleto axial?",
          "version": "1.0",
          "phase": "diagnostic",
          "evidenceLevel": "A1",
          "instruction": "Responde antes de revisar el mapa anatómico.",
          "hint": "Busca la articulación directa con el esternón.",
          "explanation": "La clavícula conecta la cintura pectoral con el esqueleto axial mediante la articulación esternoclavicular.",
          "errorPattern": "confunde_conexion_axial",
          "choices": ["Escápula", "Clavícula", "Húmero", "Ulna"],
          "correctIndex": 1
        },
        {
          "id": "bones-l01-a02",
          "type": "single_choice",
          "title": "¿Qué hueso contiene la cavidad glenoidea?",
          "version": "1.0",
          "phase": "diagnostic",
          "evidenceLevel": "A1",
          "instruction": "Elige el hueso que recibe la cabeza humeral.",
          "hint": "Piensa en la pared posterior de la cintura pectoral.",
          "explanation": "La cavidad glenoidea está en el ángulo lateral de la escápula.",
          "errorPattern": "confunde_glenoides",
          "choices": ["Escápula", "Clavícula", "Radio", "Ulna"],
          "correctIndex": 0
        },
        {
          "id": "bones-l01-a03",
          "type": "multiple_select",
          "title": "Selecciona los huesos del antebrazo",
          "version": "1.0",
          "phase": "diagnostic",
          "evidenceLevel": "A1",
          "instruction": "Puede haber más de una respuesta correcta.",
          "hint": "Se ubican entre el codo y la muñeca.",
          "explanation": "El radio y la ulna constituyen el esqueleto del antebrazo.",
          "errorPattern": "mezcla_brazo_antebrazo",
          "choices": ["Húmero", "Radio", "Ulna", "Escápula"],
          "correctIndices": [1, 2]
        },
        {
          "id": "bones-l01-a04",
          "type": "sequence",
          "title": "Ordena la cadena desde el esqueleto axial hacia distal",
          "version": "1.0",
          "phase": "diagnostic",
          "evidenceLevel": "A1",
          "instruction": "Toca cada estructura en el orden espacial correcto.",
          "hint": "La clavícula es el primer puente óseo; el antebrazo queda al final.",
          "explanation": "La cadena espacial útil es axial → clavícula → escápula → húmero → radio y ulna.",
          "errorPattern": "pierde_cadena_proximodistal",
          "choices": ["Radio y ulna", "Escápula", "Clavícula", "Húmero"],
          "correctOrder": [2, 1, 3, 0]
        }
      ]
    },
    {
      "id": "gm-pack-bones-l02",
      "title": "Clavícula y escápula",
      "kind": "learn",
      "durationMinutes": 7,
      "focus": ["A1", "A2"],
      "description": "Distingue el puente óseo anterior del hueso plano posterior y orienta sus accidentes.",
      "activities": [
        {
          "id": "bones-l02-a01",
          "type": "teach",
          "title": "Dos piezas, funciones espaciales distintas",
          "version": "1.0",
          "instruction": "Reconstruye cada hueso desde sus relaciones, no desde una silueta memorizada.",
          "cards": [
            { "symbol": "C", "label": "Clavícula", "copy": "Puente anterior; extremo esternal medial y acromial lateral." },
            { "symbol": "E", "label": "Escápula", "copy": "Hueso plano posterior; espina posterior y glenoides lateral." },
            { "symbol": "↔", "label": "Relación", "copy": "La clavícula se articula con el acromion de la escápula." }
          ],
          "memoryRule": "Esternal = medial; acromial = lateral. Espina = posterior; glenoides = lateral.",
          "mechanism": "contraste discriminativo"
        },
        {
          "id": "bones-l02-a02",
          "type": "single_choice",
          "title": "El extremo medial de la clavícula se articula con…",
          "version": "1.0",
          "phase": "guided",
          "evidenceLevel": "A1",
          "instruction": "Usa la relación con el esqueleto axial.",
          "hint": "Medial aproxima el hueso a la línea media.",
          "explanation": "El extremo esternal de la clavícula se articula con el manubrio del esternón.",
          "errorPattern": "invierte_extremos_clavicula",
          "choices": ["Manubrio del esternón", "Cabeza humeral", "Olécranon", "Radio"],
          "correctIndex": 0
        },
        {
          "id": "bones-l02-a03",
          "type": "multiple_select",
          "title": "¿Qué accidentes pertenecen a la escápula?",
          "version": "1.0",
          "phase": "retrieval",
          "evidenceLevel": "A1",
          "instruction": "Selecciona todas las opciones correctas.",
          "hint": "Busca accidentes del hueso plano de la cintura pectoral.",
          "explanation": "La espina, el acromion y la cavidad glenoidea pertenecen a la escápula.",
          "errorPattern": "mezcla_accidentes_cintura",
          "choices": ["Espina", "Acromion", "Cavidad glenoidea", "Olécranon", "Tróclea"],
          "correctIndices": [0, 1, 2]
        },
        {
          "id": "bones-l02-a04",
          "type": "single_choice",
          "title": "Si observas la espina escapular, estás mirando principalmente la cara…",
          "version": "1.0",
          "phase": "contrast",
          "evidenceLevel": "A2",
          "instruction": "La respuesta debe ayudarte a orientar una escápula aislada.",
          "hint": "La espina divide las fosas supraespinosa e infraespinosa.",
          "explanation": "La espina escapular es un accidente prominente de la cara posterior.",
          "errorPattern": "invierte_cara_escapula",
          "choices": ["Anterior", "Posterior", "Medial", "Inferior"],
          "correctIndex": 1
        },
        {
          "id": "bones-l02-a05",
          "type": "sequence",
          "title": "Ordena la orientación de la clavícula de medial a lateral",
          "version": "1.0",
          "phase": "retrieval",
          "evidenceLevel": "A2",
          "instruction": "Toca los elementos en secuencia.",
          "hint": "Comienza junto al esternón y termina junto al hombro.",
          "explanation": "De medial a lateral: extremo esternal → cuerpo → extremo acromial.",
          "errorPattern": "invierte_eje_clavicula",
          "choices": ["Extremo acromial", "Cuerpo", "Extremo esternal"],
          "correctOrder": [2, 1, 0]
        }
      ]
    },
    {
      "id": "gm-pack-bones-l03",
      "title": "Húmero: proximal y distal",
      "kind": "learn",
      "durationMinutes": 7,
      "focus": ["A1", "A2"],
      "description": "Orienta el húmero mediante la cabeza, los epicóndilos, el capítulo y la tróclea.",
      "activities": [
        {
          "id": "bones-l03-a01",
          "type": "teach",
          "title": "Un hueso largo con dos mapas articulares",
          "version": "1.0",
          "instruction": "Separa primero el extremo proximal del distal.",
          "cards": [
            { "symbol": "○", "label": "Cabeza", "copy": "Proximal y dirigida medialmente hacia la glenoides." },
            { "symbol": "C", "label": "Capítulo", "copy": "Distal y lateral; articula con la cabeza del radio." },
            { "symbol": "T", "label": "Tróclea", "copy": "Distal y medial; articula con la incisura troclear de la ulna." }
          ],
          "memoryRule": "Cabeza arriba y medial; capítulo lateral con radio; tróclea medial con ulna.",
          "mechanism": "organización jerárquica y contraste"
        },
        {
          "id": "bones-l03-a02",
          "type": "single_choice",
          "title": "¿Qué accidente identifica el extremo proximal del húmero?",
          "version": "1.0",
          "phase": "guided",
          "evidenceLevel": "A1",
          "instruction": "Elige la superficie articular que mira hacia la escápula.",
          "hint": "La glenoides recibe una estructura redondeada.",
          "explanation": "La cabeza humeral identifica el extremo proximal.",
          "errorPattern": "confunde_extremos_humero",
          "choices": ["Cabeza", "Tróclea", "Capítulo", "Fosa olecraniana"],
          "correctIndex": 0
        },
        {
          "id": "bones-l03-a03",
          "type": "multiple_select",
          "title": "Selecciona las relaciones articulares correctas del húmero distal",
          "version": "1.0",
          "phase": "contrast",
          "evidenceLevel": "A2",
          "instruction": "Puede haber más de una relación correcta.",
          "hint": "Capítulo es lateral; tróclea es medial.",
          "explanation": "El capítulo articula con el radio y la tróclea con la ulna.",